"Galaxy Gaming, Inc.",GLXZ,OTC,0000013156,"Consumer Cyclical","Services-Amusement & Recreation Services",15516894,,0000114036120009389,https://www.sec.gov/Archives/edgar/data/13156/000114036120009389/0001140361-20-009389-index.htm,8-K,2020-04-21,835300,,,40,"Las Vegas",Nevada,NV,89119,US,"Las Vegas-Henderson-Paradise, NV",http://www.galaxygaming.com,"Galaxy Gaming, Inc., a gaming company, designs, develops, acquires, assembles, markets, and licenses proprietary casino table games and associated technology, platforms, and systems for the gaming industry. The company's proprietary table games comprise side bets, which are proprietary features and wagering options added to public domain games, such as poker, baccarat, pai gow poker, craps, and blackjack table games; and premium games, which are stand-alone games with their own unique set of rules and strategies. It offers side bets under the Lucky Ladies, 21+3, and Bonus Craps titles; and premium games under the Heads Up Hold 'em, High Card Flush, and Three Card Poker. It also provides enhanced table systems, which include Bonus Jackpot System, an electronic system installed on gaming tables designed to collect data by detecting player wagers and other game activities. In addition, the company offers TableMAX e-Table system, an automated, dealer-less, multi-player electronic table game platform; and ancillary equipment. The company markets its products to land-based, cruise ships, and riverboat gaming companies in North America, the Caribbean, Central America, the British Isles, Europe, and Africa, as well as to Internet gaming sites worldwide. Galaxy Gaming, Inc. was founded in 2006 and is headquartered in Las Vegas, Nevada.",FALSE,,"Zions Bancorporation"
"XG Sciences, Inc.",XGSCI,OTC,0001435375,"Basic Materials","Business services, misc",,,0000173112220000405,https://www.sec.gov/Archives/edgar/data/1435375/000173112220000405/0001731122-20-000405-index.htm,8-K,2020-04-23,825200,,,,Lansing,Michigan,MI,48911,US,"Lansing-East Lansing, MI",https://xgsciences.com/,,FALSE,,"PNC Bank"
"Pareteum Corporation",TEUM,NASDAQ,0001084384,Technology,"EDP Services",90496796,,0000110465920062960,https://www.sec.gov/Archives/edgar/data/1084384/000110465920062960/0001104659-20-062960-index.htm,8-K,2020-05-18,818900,,33130000,138,"New York","New York",NY,10036,US,"New York-Newark-Jersey City, NY-NJ-PA",http://www.pareteum.com,"Pareteum Corporation operates a communications cloud services platform in Europe and internationally. Its platform provides mobility, messaging, and security services and applications, with a single-sign-on, application program interface (API), and software development suite. The company's platform hosts integrated IT/back office and core network functionality for mobile network operators, as well as for enterprises to implement and leverage mobile communications solutions on a Software as a Service (Saas), PaaS, or IaaS basis. It also offers operational support system for channel partners with APIs for integration with third party systems, workflows for complex application orchestration, and customer support with branded portals and plug-ins for various other applications. In addition, the company provides software solutions, which layer over disparate fixed, mobile, and IP networks to enable the deployment of converged communication services and applications for enterprise communications and core telecommunications markets; and Wi-Fi access on mobile devices through its SaaS platform. Pareteum Corporation serves the markets of Internet of Things, mobile virtual network operators, smart cities, and application developers. The company was formerly known as Elephant Talk Communications Corp. and changed its name to Pareteum Corporation in November 2016. Pareteum Corporation is based in New York, New York.",FALSE,,"Silicon Valley Bank"
"Usio, Inc.",USIO,NASDAQ,0001088034,Finance,"Investment Bankers/Brokers/Service",66177005,,0000108803420000005,https://www.sec.gov/Archives/edgar/data/1088034/000108803420000005/0001088034-20-000005-index.htm,8-K,2020-04-20,813500,,7580000,51,"San Antonio",Texas,TX,78231,US,"San Antonio-New Braunfels, TX",http://www.usio.com,"Usio, Inc., together with its subsidiaries, provides integrated electronic payment processing services to merchants and businesses in the United States. The company offers various types of automated clearing house (ACH) processing; and credit, prepaid card, and debit card-based processing services. Its ACH processing services include Represented Check, a consumer non-sufficient funds check that is represented for payment electronically rather than through the paper check collection system; and Accounts Receivable Check Conversion, a consumer paper check payment, which is converted into an e-check. The company also offers merchant account services for the processing of card-based transactions through the VISA, MasterCard, American Express, Discover, and JCB networks, including online terminal services accessed through a Website or retail services accessed through a physical terminal. In addition, it provides a proprietary Web-based customer service application that allows companies to process one-time and recurring payments through e-checks or credit cards; and an interactive voice response telephone system to companies, which accept payments directly from consumers over the telephone using e-checks or credit cards. The company markets and sells ACH products and services primarily through resellers, as well as markets and sells prepaid card program directly to corporations and to consumers through the Internet. Usio, Inc. has a strategic partnership agreement with Pineapple Payments. The company was formerly known as Payment Data Systems, Inc. and changed its name to Usio, Inc. in June 2019. Usio, Inc. was founded in 1998 and is headquartered in San Antonio, Texas.",FALSE,,"Bank of San Antonio"
"Trans-Lux Corporation",TNLX,OTC,0000099106,Technology,"Miscellaneous Manufacturing Industries",8067780,,0000151316220000091,https://www.sec.gov/Archives/edgar/data/99106/000151316220000091/0001513162-20-000091-index.htm,8-K,2020-05-04,810800,,,50,"New York","New York",NY,10022,US,"New York-Newark-Jersey City, NY-NJ-PA",http://www.trans-lux.com,"Trans-Lux Corporation designs, manufactures, and supplies digital signage display solutions and fixed digit scoreboards. The company operates in two segments, Digital Product Sales; and Digital Product Lease and Maintenance. The Digital Product Sales segment sells indoor and outdoor digital product signage products. The Digital Product Lease and Maintenance segment is involved in the lease and maintenance of indoor and outdoor digital product signage. The company offers LED display systems for use by sports arenas and stadiums; financial institutions, including brokerage firms, banks, energy companies, insurance companies, and mutual fund companies; educational institutions; outdoor advertising companies; corporate and government communication centers; retail outlets; casinos, racetracks, and other gaming establishments; airports, train stations, bus terminals, and other transportation facilities; movie theatres; and health maintenance organizations, as well as in various other applications. It also provides turnkey installation and support services. The company markets its products through direct sales representatives and a network of independent dealers and distributors in the United States and Canada; and internal sales people and independent distributors in the rest of North America, Europe, the Middle East, South America, Africa, the Far East, and Australia. Trans-Lux Corporation was founded in 1920 and is headquartered in New York, New York.",FALSE,,"Enterprise Bank and Trust"
"H-CYTE, Inc.",HCYT,OTC,0001591165,Healthcare,"Surgical and medical instruments",4690000,,0000149315220008503,https://www.sec.gov/Archives/edgar/data/1591165/000149315220008503/0001493152-20-008503-index.htm,8-K,2020-05-13,809082,,90000,,Tampa,Florida,FL,33602,US,"Tampa-St. Petersburg-Clearwater, FL",http://www.hcyte.com,"H-CYTE, Inc. operates primarily as a medical biosciences company. It develops and implements treatment options in regenerative medicine to treat chronic lung disease. H-CYTE, Inc. is headquartered in Tampa, Florida.",FALSE,,"Bank of Tampa"
"Precision Optics Corporation, Inc.",PEYE,OTC,0000867840,Healthcare,"Electromedical equipment",15585000,,0000168316820001446,https://www.sec.gov/Archives/edgar/data/867840/000168316820001446/0001683168-20-001446-index.htm,8-K,2020-05-07,808862,,,59,Gardner,Massachusetts,MA,01440,US,"Worcester, MA-CT",http://www.poci.com,"Precision Optics Corporation, Inc. designs, develops, manufactures, and sells specialized optical and illumination systems and related components primarily in the United States and the European Economic Area. The company offers medical instrumentation products, including endoscopes and endocouplers, as well as other custom imaging and illumination products, such as Microprecision lenses and micro medical cameras, and 3D endoscopes for use in minimally invasive surgical procedures by hospitals and physicians. It also provides components and assemblies, which are designed for industrial and military use. The company markets its products to original equipment manufacturers through medical device companies. It has collaboration with OmniVision Technologies, Inc. to develop optical solutions based on an image sensor integrated with its lenses. The company was founded in 1982 and is based in Gardner, Massachusetts.",FALSE,,"Bank of America"
"Avalon Holdings Corporation",AWX,"NYSE MKT",0001061069,"Public Utilities","Environmental Services",5309339,,0000143774920008512,https://www.sec.gov/Archives/edgar/data/1061069/000143774920008512/0001437749-20-008512-index.htm,8-K,2020-04-27,800000,,,521,Warren,Ohio,OH,44484,US,"Youngstown-Warren-Boardman, OH-PA",http://www.avalonholdings.com,"Avalon Holdings Corporation provides waste management services to industrial, commercial, municipal, and governmental customers in the United States. It operates through Waste Management Services, and Golf and Related Operations segments. The Waste Management Services segment offers hazardous and nonhazardous waste disposal brokerage and management services; and captive landfill management services, as well as engages in salt water injection well operations. This segment also provides turnkey services, including daily operations, facilities management, and management reporting; and sells construction mats. The Golf and Related Operations segment operates and manages three golf courses and related clubhouses, a hotel, and a travel agency. Its golf and country club facilities provide swimming pools, fitness centers, tennis courts, dining, and banquet and conference facilities, as well as spa services. The company also owns and operates hotel under the brand of The Grand Resort, which provides various facilities, such as swimming pool, fitness center, rooms, restaurants, bars, banquet, and conference facilities, as well as adjoining tennis center. The company was founded in 1998 and is headquartered in Warren, Ohio.",FALSE,,Unidentified
"Pixelworks, Inc.",PXLW,NASDAQ,0001040161,Technology,Semiconductors,143456792,,0000104016120000021,https://www.sec.gov/Archives/edgar/data/1040161/000104016120000021/0001040161-20-000021-index.htm,8-K,2020-04-30,796242,,16060000,229,"San Jose",California,CA,95110,US,"San Jose-Sunnyvale-Santa Clara, CA",http://www.pixelworks.com,"Pixelworks, Inc. develops and markets semiconductor and software solutions. The company provides video display processor products, including image processor ICs, such as embedded microprocessors, digital signal processing technology, and software that control the operations and signal processing within high-end display systems; and video co-processor ICs that work with an image processor to post-process video signals to enhance the performance or feature set of the overall video solution, as well as transcoder ICs, such as embedded microprocessors, digital signal processing technology, and software that control the operations and signal processing for converting bitrates, resolutions, and codecs. As of December 31, 2019, it had an intellectual property portfolio of 347 patents related to the visual display of digital image data. The company's products are used in smartphones, tablets, and projectors. Pixelworks, Inc. sells its products through a direct sales force, as well as distributors and manufacturers' representatives worldwide. The company was founded in 1997 and is headquartered in San Jose, California.",FALSE,,"Silicon Valley Bank"
"Intellicheck, Inc.",IDN,NASDAQ,0001040896,Technology,"Computer Software: Prepackaged Software",209962948,,0000149315220006641,https://www.sec.gov/Archives/edgar/data/1040896/000149315220006641/0001493152-20-006641-index.htm,8-K,2020-04-17,796100,,2230000,34,Melville,"New York",NY,11747,US,"New York-Newark-Jersey City, NY-NJ-PA",http://intellicheck.com,"Intellicheck, Inc., a technology company, develops, integrates, and markets threat identification and identity authentication solutions for retail fraud prevention, law enforcement threat identification, and mobile and handheld access control and security systems primarily in the United States. It provides identity systems products, including commercial identification products, such as ID Check SDK for software developers; Retail ID, an authentication solution that authenticates identification documents; Retail ID Online, authenticates an online user's identification documents; Retail ID Mobile that provides the fraud reduction benefits of Retail ID; Age ID, a designation for various hand held devices; Guest ID, a software application that speeds up check-in and ID verification at hotels and motels; ID Check POS, a software application that runs on various VeriFone devices; ID Check BHO, a browser helper object for Microsoft browser; ID Check PC, a standalone software solution; State Aware software; software products for data collection devices; and instant credit application kiosk software applications. The company also offers government identification products comprising Defense ID systems to read barcodes, magnetic stripes, radio frequency identification, and optical character recognition codes printed on current forms of identification cards; PORT ID, an instrumental component to port security; and Visitor Center (IM 3000), a component of Defense ID system. It serves government, military, and commercial markets. The company was formerly known as Intellicheck Mobilisa, Inc. and changed its name to Intellicheck, Inc. in May 2017. Intellicheck, Inc. was founded in 1994 and is headquartered in Melville, New York.",FALSE,,"First National Bank of Carmi"
"Energy Focus, Inc.",EFOI,NASDAQ,0000924168,"Consumer Durables","Building Products",14111633,,0000092416820000025,https://www.sec.gov/Archives/edgar/data/924168/000092416820000025/0000924168-20-000025-index.htm,8-K,2020-04-23,794965,,3460000,42,Solon,Ohio,OH,44139,US,"Cleveland-Elyria, OH",http://www.energyfocus.com,"Energy Focus, Inc., together with its subsidiaries, designs, develops, manufactures, markets, and sells energy-efficient lighting systems in the United States and internationally. It offers military maritime light-emitting diode (LED) lighting products, such as Military Intellitube, globe lights, berth lights, fixtures, and LED retrofit kits, as well as Invisitube ultra-low EMI tubular LED (TLED) and EnFocus lighting platform to serve the United States navy and allied foreign navies. The company also provides commercial products comprising direct-wire ended and double-ended TLED replacements for linear fluorescent lamps; LED fixtures for fluorescent replacement or high-intensity discharge replacement in low-bay, high-bay, and office applications; LED down-lights; LED dock lights and wall-packs; LED vapor tight lighting fixtures; LED retrofit kits; RedCap emergency battery backup TLEDs; and EnFocus lighting platform. It sells its products to military maritime, industrial, healthcare, education, and commercial markets through direct sales employees, lighting agents, independent sales representatives, and distributors. The company was formerly known as Fiberstars, Inc. and changed its name to Energy Focus, Inc. in May 2007. Energy Focus, Inc. was founded in 1985 and is headquartered in Solon, Ohio.",FALSE,,KeyBank
"Edison Nation, Inc.",EDNT,NASDAQ,0001717556,"Consumer Non-Durables","Recreational Products/Toys",24366428,,0000149315220007115,https://www.sec.gov/Archives/edgar/data/1717556/000149315220007115/0001493152-20-007115-index.htm,8-K,2020-04-27,789852,,,52,Phillipsburg,"New Jersey",NJ,08865,US,"New York-Newark-Jersey City, NY-NJ-PA",http://edisonnation.com,"Edison Nation, Inc. operates as a consumer product research and development, manufacturing, sales, and fulfillment company worldwide. The company also creates, manufactures, and markets products for the infants/toddlers under the Cloud b brand name through its e-commerce site and other online e-tailers, as well as specialty boutiques, gift stores, and retailers. In addition, it operates Web-enabled new product development and licensing platform. Further, the company offers shipping services. Edison Nation, Inc. has a strategic alliance with venture partner IdeaPros. The company was formerly known as Xspand Products Lab, Inc. and changed its name to Edison Nation, Inc. in September 2018. Edison Nation, Inc. was incorporated in 2017 and is based in Bethlehem, New Jersey.",FALSE,,"BHP Capital NY"
"Precipio, Inc.",PRPO,NASDAQ,0001043961,"Capital Goods","Biotechnology: Laboratory Analytical Instruments",35659716,,0000110465920051038,https://www.sec.gov/Archives/edgar/data/1043961/000110465920051038/0001104659-20-051038-index.htm,8-K,2020-04-24,787200,,2300000,50,"New Haven",Connecticut,CT,06511,US,"New Haven-Milford, CT",http://www.precipiodx.com,"Precipio, Inc., a cancer diagnostics company, provides diagnostic products and services in the United States oncology market. Its product consists of clinical diagnostic services. The company's clinical diagnostic services focus on the diagnosis of different hematopoietic or blood-related cancers to oncologists. Its cytogenetics media IV-Cell enables laboratories to arrive at more accurate results; and HemeScreen panel enables hospitals and laboratories to run an important genetic mutation test. It serves oncologists, hospitals, reference laboratories, and pharma and biotech companies. Precipio, Inc. has collaborations with academic institutions specializing in cancer research, diagnostics, and treatment, such as the Yale School of Medicine and Harvard's Dana-Farber Cancer Institute. The company is based in New Haven, Connecticut.",FALSE,,"Webster Bank"
"Giga-tronics Incorporated",GIGA,OTC,0000719274,Technology,"Instruments to measure electricity",7133472,,0000143774920008559,https://www.sec.gov/Archives/edgar/data/719274/000143774920008559/0001437749-20-008559-index.htm,8-K,2020-04-27,786200,,,39,Dublin,California,CA,94568,US,"San Francisco-Oakland-Hayward, CA",http://www.gigatronics.com,"Giga-tronics Incorporated, together with its subsidiaries, develops and manufactures microwave integrated components for military airborne applications in the United States, Europe, Asia, and internationally. It operates through two segments, Microsource and the Giga-tronics Division. The company also develops Band Reject Filters for RADAR/EW (electronic warfare) applications; self-protection systems; and RADAR filters for military fighter jet aircraft. In addition, it designs, manufactures, and markets functional test products for testing RADAR/EW equipment of the defense electronics market. The company serves prime defense contractors, the armed services, and research institutes. Giga-tronics Incorporated was founded in 1980 and is based in Dublin, California.",FALSE,,"Western Alliance Bank"
"CareView Communications, Inc.",CRVW,OTC,0001377149,Healthcare,"Radio and TV communications equipment",1951334,,0000138713120003977,https://www.sec.gov/Archives/edgar/data/1377149/000138713120003981/0001387131-20-003981-index.htm,8-K,2020-04-17,781800,,,54,Lewisville,Texas,TX,75067,US,"Dallas-Fort Worth-Arlington, TX",http://www.careviewinc.com,"CareView Communications, Inc. provides products and on-demand application services for the healthcare industry in the United States. The company offers NurseView module to view monitored rooms from the nurse's station; PhysicianView module to view patients from any personal computer; Virtual Bed Rails and Virtual Chair Rails fall prevention modules; Fall Management Program to separately file, identify, and research the activity of patients; Sitter Management Program to monitor patient rooms from nursing station or mobile device; and timed rounding modules to help nursing staff monitor patients. It also provides BedView module to monitor the status and availability of facility beds remotely; delivery mechanism for patient education materials; FacilityView module that monitors and records activity in any area that the hospital would desire security cameras to be placed; monitoring system for nursing alerts and reminders; and ulcer management systems. In addition, the company offers CareView Mobile, a communications device and mobile monitoring system; CareView Mobile App; NICUView that provides a live continual feed from the neo-natal intensive care unit allowing parents, friends, or families to view the newborn and obtain clinical information from home; and broadcast systems to broadcast various educational, informational, and service communications to patients and guests. CareView Communications, Inc. is based in Lewisville, Texas.",FALSE,,"Bank of Oklahoma"
"Motus GI Holdings, Inc.",MOTS,NASDAQ,0001686850,"Health Care","Medical/Dental Instruments",30564841,,0000121390020010288,https://www.sec.gov/Archives/edgar/data/1686850/000121390020010288/0001213900-20-010288-index.htm,8-K,2020-04-28,780942,"Filed notice with SEC that the company will return $780,942 loan on 4/28/20.",120000,49,"Fort Lauderdale",Florida,FL,33301,US,"Miami-Fort Lauderdale-West Palm Beach, FL",http://www.motusgi.com,"Motus GI Holdings, Inc., medical technology company, provides endoscopy solutions that enhance clinical outcomes and the cost-efficiency associated with the diagnosis and management of gastrointestinal conditions in the United States and Israel. It focuses on the development and commercialization of the Pure-Vu system, a medical device, which indicates to facilitate the cleaning of a poorly prepared colon during the colonoscopy procedure. The company is based in Fort Lauderdale, Florida.",TRUE,https://www.sec.gov/Archives/edgar/data/1686850/000121390020011658/0001213900-20-011658-index.htm,"Silicon Valley Bank"
"CloudCommerce, Inc.",CLWD,OTC,0000743758,Technology,"Retail-Miscellaneous Retail",217660,,0000106594920000057,https://www.sec.gov/Archives/edgar/data/743758/000106594920000057/0001065949-20-000057-index.htm,8-K,2020-05-12,780680,,,49,"San Antonio",Texas,TX,78215,US,"San Antonio-New Braunfels, TX",http://www.cloudcommerce.com,"CloudCommerce, Inc. provides data driven solutions worldwide. Its solutions help its clients to acquire, engage, and retain their customers by leveraging digital strategies and technologies. The company offers data analytics for retail, wholesale, distribution, logistics, manufacturing, political, and other industries; digital marketing services; branding and creative services; and development and managed infrastructure support services. The company was formerly known as Warp 9, Inc. and changed its name to CloudCommerce, Inc. in September 2015. CloudCommerce, Inc. was founded in 1998 and is based in San Antonio, Texas.",FALSE,,"Cache Valley Bank"
"NeuroMetrix, Inc.",NURO,NASDAQ,0001289850,"Health Care","Medical/Dental Instruments",11959516,,0000162828020006000,https://www.sec.gov/Archives/edgar/data/1289850/000162828020006000/0001628280-20-006000-index.htm,8-K,2020-04-30,773200,"Filed notice with SEC that the company will return $773,200 loan on 4/30/20.",,23,Woburn,Massachusetts,MA,01801,US,"Boston-Cambridge-Newton, MA-NH",http://www.neurometrix.com,"NeuroMetrix, Inc., a healthcare company, develops and markets products for the detection, diagnosis, and monitoring of peripheral nerve and spinal cord disorders. The company develops wearable neuro-stimulation therapeutic devices and point-of-care neuropathy diagnostic tests to address chronic health conditions, including chronic pain, sleep disorders, and diabetes. Its marketed products include Quell, a wearable device for relief of chronic intractable pain, such as nerve pain due to diabetes and lower back problems; DPNCheck, a test used to evaluate systemic neuropathies, such as diabetic peripheral neuropathy; ADVANCE system, a platform for the performance of traditional nerve conduction studies; and SENSUS, a pain therapy device based on transcutaneous electrical nerve stimulation for relief of chronic intractable pain. The company offers its products to consumers, retail merchandisers, direct response TV promoters, health care professionals, managed care organizations, endocrinologists, podiatrists, physicians, neurologists, and physical medicine and rehabilitation centers, as well as primary care, internal medicine, orthopedic, hand, and neurosurgeons. It operates in the United States, Europe, Japan, China, the Middle East, and Mexico. The company has a strategic collaboration with GlaxoSmithKline. NeuroMetrix, Inc. was founded in 1996 and is based in Woburn, Massachusetts.",TRUE,https://www.sec.gov/Archives/edgar/data/1289850/000162828020006968/0001628280-20-006968-index.htm,"Comerica Bank"
