"Live Ventures Incorporated",LIVE,NASDAQ,0001045742,Finance,"Finance/Investors Services",19909645,,0000156459020023187,https://www.sec.gov/Archives/edgar/data/1045742/000156459020023187/0001564590-20-023187-index.htm,8-K,2020-05-08,4767887,,,650,"Las Vegas",Nevada,NV,89119,US,"Las Vegas-Henderson-Paradise, NV",http://www.liveventures.com,"Live Ventures Incorporated, a holding company, engages in the manufacturing, retail and online, and service businesses in the United States. Its Manufacturing segment manufactures and markets carpets and rugs, and yarn products focusing on the residential, niche commercial, and hospitality end-markets; and resells hard surface flooring products. This segment serves flooring dealers, home centers, and other flooring manufacturers, as well as directly to end users. The company's Retail and Online segment operates 62 specialty entertainment retail storefronts that offer entertainment products, including new and pre-owned movies, video games, and music products, as well as ancillary products, such as books, comics, toys, and collectibles. It buys, sells, and trades in new and pre-owned movies, music, video games, electronics, and collectibles through 35 Vintage Stock, 3 V-Stock, 13 Movie Trading company, and 11 EntertainMart retail locations in Missouri, Texas, Oklahoma, Kansas, Arkansas, Utah, Colorado, Illinois, Idaho, and New Mexico, as well as sells new and used movies, video games, music, and toys through Website, vintagestock.com. This segment also offers services to customers, such as rentals, special orders, disc and video game hardware repair services, and other services. Its Services segment offers InstantProfile line of products and services primarily consisting of directory listing services. The company was formerly known as LiveDeal, Inc. and changed its name to Live Ventures Incorporated in October 2015. Live Ventures Incorporated was founded in 1968 and is based in Las Vegas, Nevada.",FALSE,,"Bank of America"
"Emmis Communications Corporation",EMMS,NASDAQ,0000783005,"Consumer Services",Broadcasting,18224773,,0000156459020017256,https://www.sec.gov/Archives/edgar/data/783005/000156459020017256/0001564590-20-017256-index.htm,8-K,2020-04-17,4753000,,,350,Indianapolis,Indiana,IN,46204,US,"Indianapolis-Carmel-Anderson, IN",http://www.emmis.com,"Emmis Communications Corporation, a diversified media company, engages in the radio broadcasting activities in the United States. It operates 11 FM and 3 AM radio stations in New York, Indianapolis, and Austin, as well as publishes Indianapolis monthly magazine. The company also develops and licenses TagStation; NextRadio, a smartphone application that marries over-the-air FM radio broadcasts with visual and interactive features on smartphones; and DialReport, a data attribution platform for the radio industry, as well as offers dynamic pricing solutions. Emmis Communications Corporation was founded in 1981 and is headquartered in Indianapolis, Indiana.",FALSE,,"STAR Financial Bank"
"Conformis, Inc.",CFMS,NASDAQ,0001305773,"Health Care","Industrial Specialties",56720861,,0000130577320000043,https://www.sec.gov/Archives/edgar/data/1305773/000130577320000043/0001305773-20-000043-index.htm,8-K,2020-04-20,4719800,,18250000,262,Billerica,Massachusetts,MA,01821,US,"Boston-Cambridge-Newton, MA-NH",http://www.conformis.com,"Conformis, Inc., a medical technology company, develops, manufactures, and sells joint replacement implants. The company offers personalized knee replacement products, including iTotal CR, a cruciate-retaining product; iTotal PS, a posterior cruciate ligament substituting product; iDuo, a personalized bicompartmental knee replacement system; and iUni, a personalized unicompartmental knee replacement product to treat the medial or lateral compartment of the knee. It also provides Conformis Hip System, a hip replacement product; and iJigs, a customized single-use patient-specific instrumentation. The company markets and sells its products to hospitals and other medical facilities through sales force, independent sales representatives, and distributors in the United States, Germany, the United Kingdom, Austria, Ireland, Switzerland, Singapore, Hong Kong, Malaysia, Monaco, Hungary, Spain, and Australia. Conformis, Inc. was founded in 2004 and is headquartered in Billerica, Massachusetts.",FALSE,,"East West Bank"
"Atlas Financial Holdings, Inc.",AFH,NASDAQ,0001539894,Finance,"Property-Casualty Insurers",4896553,,0000153989420000028,https://www.sec.gov/Archives/edgar/data/1539894/000153989420000028/0001539894-20-000028-index.htm,8-K,2020-05-05,4600500,,49240000,286,Schaumburg,Illinois,IL,60173,US,"Chicago-Naperville-Elgin, IL-IN-WI",http://www.atlas-fin.com,"Atlas Financial Holdings, Inc., through its subsidiaries, engages in underwriting commercial automobile insurance policies in the United States. The company's automobile insurance products provide insurance coverage in three primary areas, including liability, accident benefits, and physical damage. It focuses on the light commercial automobile sector, including taxi cabs, non-emergency para-transit, limousine, livery, and business autos. The company distributes its insurance products through a network of retail independent agents. Atlas Financial Holdings, Inc. is headquartered in Schaumburg, Illinois.",FALSE,,"Fifth Third Bank"
"Natural Gas Services Group, Inc.",NGS,NYSE,0001084991,Energy,"Oilfield Services/Equipment",127684215,,0000108499120000019,https://www.sec.gov/Archives/edgar/data/1084991/000108499120000019/0001084991-20-000019-index.htm,8-K,2020-04-16,4600000,,17800000,270,Midland,Texas,TX,79705,US,"Midland, TX",http://www.ngsgi.com,"Natural Gas Services Group, Inc. provides natural gas compression services and equipment to the energy industry in the United States. It fabricates, manufactures, rents, and sells natural gas compressors and related equipment. The company primarily engages in the rental of compression units that provide small, medium, and large horsepower applications for unconventional oil and natural gas production. As of December 31, 2019, the company had 2,304 natural gas compression units in its rental fleet with 429,650 horsepower. The company also engages in the design, fabrication, and assembly of compressor components into compressor units for rental or sale; engineers and fabricates natural gas compressors; and designs and manufactures a line of reciprocating compressor frames, cylinders, and parts. In addition, it is involved in the design, fabrication, sale, installation, and service of flare stacks and related ignition and control devices for the onshore and offshore incineration of gas compounds, such as hydrogen sulfide, carbon dioxide, natural gas, and liquefied petroleum gases. Further, the company offers customer support services for its compressor and flare sales business; an exchange and rebuild program for small horsepower screw compressors; and maintains an inventory of new and used compressors. Its primary customers are exploration and production companies that utilize compressor units for artificial lift applications; E&P companies that focuses on natural gas-weighted production; and midstream companies. Natural Gas Services Group, Inc. was founded in 1998 and is headquartered in Midland, Texas.",FALSE,,"JPMorgan Chase Bank"
"Graham Corporation",GHM,NYSE,0000716314,Technology,"Industrial Machinery/Components",151449236,,0000119312520114323,https://www.sec.gov/Archives/edgar/data/716314/000119312520114323/0001193125-20-114323-index.htm,8-K,2020-04-22,4599003,"Filed notice with SEC that the company will return $4,599,003 loan on 4/22/20.",22000000,337,Batavia,"New York",NY,14020,US,"Batavia, NY",http://www.graham-mfg.com,"Graham Corporation, together with its subsidiaries, designs, manufactures, and supplies vacuum and heat transfer equipment for the chemical, defense, petrochemical, petroleum refining, electric power generation, and other industries worldwide. It offers heat transfer equipment, including surface condensers, heliflows, water heaters, and various types of heat exchangers, as well as custom-engineered ejectors; and vacuum equipment, such as steam jet ejector vacuum systems and liquid ring vacuum pumps. The company also services and sells spare parts for its equipment. In addition, it engages in fabrication and machining activities. The company sells its products directly, as well as through independent sales representatives. Graham Corporation was founded in 1936 and is headquartered in Batavia, New York.",TRUE,https://www.sec.gov/Archives/edgar/data/716314/000119312520124558/0001193125-20-124558-index.htm,"JPMorgan Chase Bank"
"Recro Pharma, Inc.",REPH,NASDAQ,0001588972,"Health Care","Major Pharmaceuticals",67387198,,0000119312520144139,https://www.sec.gov/Archives/edgar/data/1588972/000119312520144139/0001193125-20-144139-index.htm,8-K,2020-05-15,4415500,,19450000,213,Malvern,Pennsylvania,PA,19355,US,"Philadelphia-Camden-Wilmington, PA-NJ-DE-MD",http://www.recropharma.com,"Recro Pharma, Inc. a contract development and manufacturing organization, engages in the development, manufacturing, and packaging of oral solid dose drug products to pharmaceutical market in the United States and internationally. The company was formerly known as Recro Pharma I, Inc. and changed its name to Recro Pharma, Inc. in August 2008. Recro Pharma, Inc. was founded in 2007 and is based in Malvern, Pennsylvania.",FALSE,,"PNC Bank"
"Avid Bioservices, Inc.",CDMO,NASDAQ,0000704562,"Health Care","Major Pharmaceuticals",698858580,,0000168316820001267,https://www.sec.gov/Archives/edgar/data/704562/000168316820001267/0001683168-20-001267-index.htm,8-K,2020-04-23,4400000,"Filed notice with SEC that the company will return $4,400,000 loan on 4/23/20.",8940000,211,Tustin,California,CA,92780,US,"Los Angeles-Long Beach-Anaheim, CA",http://avidbio.com,"Avid Bioservices, Inc., a contract development and manufacturing organization, provides process development and Current Good Manufacturing Practices (CGMP) commercial manufacturing services focused on biopharmaceutical products derived from mammalian cell culture for biotechnology and pharmaceutical companies. The company produces monoclonal antibodies and recombinant proteins in batch, fed-batch, and perfusion modes; and offers services, including cGMP clinical and commercial product manufacturing, purification, bulk packaging, stability testing, and regulatory submission and support. It also provides various process development services, such as cell line development and optimization, cell culture and feed optimization, analytical methods development, and product characterization. The company was formerly known as Peregrine Pharmaceuticals, Inc. and changed its name to Avid Bioservices, Inc. in January 2018. Avid Bioservices, Inc. was founded in 1981 and is headquartered in Tustin, California.",TRUE,https://www.sec.gov/Archives/edgar/data/704562/000168316820001625/0001683168-20-001625-index.htm,"City National Bank"
"AstroNova, Inc.",ALOT,NASDAQ,0000008146,Technology,"Computer peripheral equipment",76365676,,0000119312520139884,https://www.sec.gov/Archives/edgar/data/8146/000119312520139884/0001193125-20-139884-index.htm,8-K,2020-05-12,4400000,,29750000,365,"West Warwick","Rhode Island",RI,02893,US,"Providence-Warwick, RI-MA",http://www.astronovainc.com,"AstroNova, Inc. designs, develops, manufactures, and distributes specialty printers, and data acquisition and analysis systems in the United States, Canada, Asia, Europe, Central and South America, and internationally. The company operates through two segments, Product Identification and Test & Measurement (T&M). The Product Identification segment offers tabletop and work cell-ready digital color label printers, as well as specialty OEM printing systems under the QuickLabel brand; and labels, tags, inks, toner, and thermal transfer ribbons under the GetLabels brand. This segment also offers T2-C, a digital mini press for 24/7 label production; T2, a label press with a full-size PC display; T4 for print, die cut, and lamination; and T3, a modular over-printer under the TrojanLabel brand. In addition, this segment licenses various specialized software used to operate the printers and presses, design labels, and manage printing on an automated basis. It serves chemicals, cosmetics, food and beverage, medical products, pharmaceuticals, and other industries, as well as brand owners, label converters, commercial printers, and packaging manufacturers. The T&M segment offers visual data from local and networked data streams and sensors; a range of hardware and software products under the AstroNova T&M brand; Daxus DXS-100 distributed data acquisition systems; TMX high-speed data acquisition systems; SmartCorder DDX100 portable data acquisition systems; EV-500, a digital strip chart recording system; PTA-45B cockpit printers; and ToughWriter, Miltope, and RITEC branded airborne printers. Its AstroNova airborne printers are used in flight decks, as well as military, commercial, and business aircraft cabins; and ToughSwitch Ethernet switches used in military aircraft and vehicles. The company was formerly known as Astro-Med, Inc. and changed its name to AstroNova, Inc. in May 2016. The company was founded in 1969 and is headquartered in West Warwick, Rhode Island.",FALSE,,"Greenwood Credit Union"
"OptiNose, Inc.",OPTN,NASDAQ,0001494650,"Health Care","Major Pharmaceuticals",215613485,,0000149465020000039,https://www.sec.gov/Archives/edgar/data/1494650/000149465020000039/0001494650-20-000039-index.htm,8-K,2020-04-16,4400000,"Filed notice with SEC that the company will return $4,400,000 loan on 4/16/20.",8290000,221,Yardley,Pennsylvania,PA,19067,US,"Philadelphia-Camden-Wilmington, PA-NJ-DE-MD",http://www.optinose.com,"OptiNose, Inc., a specialty pharmaceutical company, focuses on the development and commercialization of products for patients treated by ear, nose, and throat; and allergy specialists in the United States. The company offers XHANCE, a therapeutic product utilizing its proprietary optinose exhalation delivery system that delivers a topically-acting and anti-inflammatory corticosteroid for the treatment of chronic rhinosinusitis with and without nasal polyps. It is also developing XHANCE, which is in Phase IIIb clinical trial for the treatment of chronic sinusitis; and OPN-300 for the treatment of Prader-Willi syndrome, a rare genetic obesity disorder, as well as autism spectrum disorder. The company has a license agreement with Currax Pharmaceuticals LLC for the commercialization of Onzetra Xsail (sumatriptan nasal powder) to treat migraine in adults; and Inexia Limited to develop, manufacture, import, and sale products containing orexin receptor agonist and/or orexin receptor positive modulator molecules for the treatment, diagnosis, or prevention of human diseases or conditions associated primarily with orexin receptor agonism and orexin receptor positive modulation. OptiNose, Inc. was founded in 2010 and is headquartered in Yardley, Pennsylvania.",TRUE,https://www.sec.gov/Archives/edgar/data/1494650/000149465020000041/0001494650-20-000041-index.htm,"JPMorgan Chase Bank"
"Alphatec Holdings, Inc.",ATEC,NASDAQ,0001350653,"Health Care","Medical/Dental Instruments",1138734993,,0000156459020018698,https://www.sec.gov/Archives/edgar/data/1350653/000156459020018698/0001564590-20-018698-index.htm,8-K,2020-04-27,4300000,,29420000,227,Carlsbad,California,CA,92008,US,"San Diego-Carlsbad, CA",http://www.atecspine.com,"Alphatec Holdings, Inc., a medical technology company, designs, develops, and markets products for the surgical treatment of spine disorders. The company offers MIS products consisting of Battalion Lateral Spacer System and Squadron Lateral Retractor, and Illico Minimally Invasive Surgery System; and thoracolumbar fixation products, such as Arsenal Degenerative, Arsenal Deformity, Arsenal CBx Cortical Bone Fixation, and Zodiac Degenerative Spinal Fixation Systems. It also provides cervical and cervico-thoracic products, including Trestle Luxe Anterior Cervical Plate System, and Solanas Posterior Cervico/Thoracic Fixation System and Avalon Occipital Plate; and interbody systems, such as Battalion Universal Spacer System, Novel PEEK and Titanium Spinal Spacers, and Alphatec Solus Locking ALIF Spinal Spacer. In addition, the company offers biologics consisting of AlphaGraft Structural Allograft Spacers, AlphaGraft ProFuse Demineralized Bone Scaffold, Amnioshield Amniotic Tissue Barrier, Alphagraft Demineralized Bone Matrix, and Neocore Osteoconductive Matrix. It sells its products through a network of independent distributors and direct sales representatives in the United States. Alphatec Holdings, Inc. was founded in 1990 and is headquartered in Carlsbad, California.",FALSE,,"Silicon Valley Bank"
"Red Lion Hotels Corporation",RLH,NYSE,0001052595,"Consumer Services",Hotels/Resorts,88107983,,0000119312520117249,https://www.sec.gov/Archives/edgar/data/1052595/000119312520117249/0001193125-20-117249-index.htm,8-K,2020-04-23,4233500,,15340000,285,Denver,Colorado,CO,80202,US,"Denver-Aurora-Lakewood, CO",http://www.redlion.com,"Red Lion Hotels Corporation, doing business as RLH Corporation, operates as a hospitality and leisure company the United States. It operates in two segments, Company Operated Hotels and Franchised Hotels. The company owns, manages, and franchises upscale, midscale, and economy hotels under the Hotel RL, Red Lion Hotels, Red Lion Inn & Suites, GuestHouse, Settle Inn, Americas Best Value Inn, Canadas Best Value Inn, Signature and Signature Inn, Knights Inn, and Country Hearth Inns & Suites brands. It also develops technology and system offerings for the hospitality industry. As of December 31, 2018, it had a network of 1,318 franchised hotels, including a total of 83,800 rooms. The company was formerly known as WestCoast Hospitality Corporation and changed its name to Red Lion Hotels Corporation in September 2005. Red Lion Hotels Corporation was founded in 1937 and is headquartered in Denver, Colorado.",FALSE,,"Idaho First Bank"
"Vertex Energy, Inc.",VTNR,NASDAQ,0000890447,Energy,"Integrated oil Companies",32425936,,0000158069520000189,https://www.sec.gov/Archives/edgar/data/890447/000158069520000189/0001580695-20-000189-index.htm,8-K,2020-05-06,4222000,,44730000,215,Houston,Texas,TX,77058,US,"Houston-The Woodlands-Sugar Land, TX",http://www.vertexenergy.com,"Vertex Energy, Inc., an environmental services company, provides a range of services designed to aggregate, process, and recycle industrial and commercial waste systems in the Gulf Coast and Central Midwest regions of the United States. The company operates in three segments: Black Oil, Refining and Marketing, and Recovery. The Black Oil segment collects and purchases used motor oil directly from third-party generators; aggregates used motor oil from a network of local and regional collectors; and sells used motor oil to customers for use as a feedstock or replacement fuel for industrial burners. It also produces and sells a vacuum gas oil product to refineries and marine fuels market; and base oil product to lubricant packagers and distributors. The Refining and Marketing segment gathers hydrocarbon streams in the form of petroleum distillates, transmix, and other chemical products that are purchased from pipeline operators, refineries, chemical processing facilities, and third-party providers; and sells end products, such as gasoline blendstock, pygas, and fuel oil cutter stock to oil companies or to petroleum trading and blending companies. The Recovery segment generates solutions for the recovery and management of hydrocarbon streams; and owns and operates a fleet of trucks and other vehicles used for shipping and handling equipment and scrap materials. Vertex Energy, Inc. is headquartered in Houston, Texas.",FALSE,,"Texas Citizens Bank"
"Collectors Universe, Inc.",CLCT,NASDAQ,0001089143,Miscellaneous,"Business Services",680568769,,0000149315220006801,https://www.sec.gov/Archives/edgar/data/1089143/000149315220006801/0001493152-20-006801-index.htm,8-K,2020-04-21,4200000,"Filed notice with SEC that the company will return $4,200,000 loan on 4/21/20.",,377,"Santa Ana",California,CA,92705,US,"Los Angeles-Long Beach-Anaheim, CA",http://www.collectorsuniverse.com,"Collectors Universe, Inc. provides authentication and grading services to dealers and collectors of coins, trading cards, event tickets, autographs, and historical and sports memorabilia in the United States. The company operates through three segments: Coins, Trading Cards, and Autographs and Other Collectibles. It also publishes magazines that provide market prices and information for various collectibles and high-value assets that are accessible on its Websites. In addition, the company sells advertising; operates an online market for graded collectible coins for dealers on subscription basis; and promotes, manages, and operates the Long Beach Coin shows. It serves dealers, collectors, and retail buyers and sellers of collectibles. The company was founded in 1986 and is headquartered in Santa Ana, California.",TRUE,https://www.sec.gov/Archives/edgar/data/1089143/000149315220007511/0001493152-20-007511-index.htm,"Zions Bancorporation"
"Xeris Pharmaceuticals, Inc.",XERS,NASDAQ,0001346302,"Health Care","Major Pharmaceuticals",240964055,,0000134630220000024,https://www.sec.gov/Archives/edgar/data/1346302/000134630220000024/0001346302-20-000024-index.htm,8-K,2020-04-24,4190000,,1430000,202,Chicago,Illinois,IL,60601,US,"Chicago-Naperville-Elgin, IL-IN-WI",http://www.xerispharma.com,"Xeris Pharmaceuticals, Inc., a specialty pharmaceutical company, develops and commercializes ready-to-use injectable and infusible drug formulations. Its proprietary XeriSol and XeriJect formulation technologies allow for the subcutaneous and intramuscular delivery of highly-concentrated, ready-to-use formulations of peptides, proteins, antibodies, and small molecules using commercially available syringes, auto-injectors, multi-dose pens, and infusion pumps. The company's lead product candidate is Gvoke HypoPen, which has completed Phase III clinical trials for the treatment of severe hypoglycemia, a potentially life-threatening condition in people with diabetes. Its product candidates also comprise ready-to-use glucagon that is in Phase II clinical trials for the treatment of congenital hyperinsulinism, post-bariatric hypoglycemia, exercise-induced hypoglycemia in diabetes, and hypoglycemia-associated autonomic failure, as well as for treating hypoglycemia associated with intermittent and chronic conditions, and bi-hormonal artificial pancreas closed-loop systems. In addition, it develops continuous subcutaneous glucagon infusion system of ready-to-use glucagon; ready-to-use diazepam formulation, which is in Phase I clinical trial for the treatment of acute repetitive seizures in patients with epilepsy; and Pramlintide-Insulin co-formulation that is in pre-clinical stage for treating type 1 and 2 diabetes. Xeris Pharmaceuticals, Inc. serves patients, caregivers, and health practitioners. The company was founded in 2005 and is based in Chicago, Illinois.",FALSE,,"Silicon Valley Bank"
"U.S. Auto Parts Network, Inc.",PRTS,NASDAQ,0001378950,"Consumer Services","Other Specialty Stores",586301813,,0000137895020000004,https://www.sec.gov/Archives/edgar/data/1378950/000137895020000004/0001378950-20-000004-index.htm,8-K,2020-04-16,4107388,"Filed notice with SEC that the company will return $4,107,388 loan on 4/16/20.",82950000,843,Carson,California,CA,90746,US,"Los Angeles-Long Beach-Anaheim, CA",http://www.usautoparts.net,"U.S. Auto Parts Network, Inc., together with its subsidiaries, operates as an online provider of aftermarket auto parts and accessories primarily in the United States and the Philippines. It offers collision parts, such as parts for the exterior of an automobile; mirror products; engine parts comprising engine and chassis components, as well as other mechanical and electrical parts; and performance parts and accessories to individual consumers through its network of e-commerce Websites and online marketplaces. The company also sells and delivers auto parts to collision repair shops from its Chesapeake, Virginia warehouse facility; markets Kool-Vue products to auto parts wholesale distributors; aftermarket catalytic converters under the Evan Fischer brand; and serves consumers by operating a retail outlet store in LaSalle, Illinois. Its flagship Websites include autopartswarehouse.com, carparts.com, and jcwhitney.com. U.S. Auto Parts Network, Inc. was founded in 1995 and is headquartered in Carson, California.",TRUE,https://www.sec.gov/Archives/edgar/data/1378950/000137895020000010/0001378950-20-000010-index.htm,"JPMorgan Chase Bank"
