"LiveXLive Media, Inc.",LIVX,NASDAQ,0001491419,"Consumer Services",Restaurants,236504518,,0000121390020009482,https://www.sec.gov/Archives/edgar/data/1491419/000121390020009482/0001213900-20-009482-index.htm,8-K,2020-04-17,2000000,,10190000,76,"West Hollywood",California,CA,90069,US,"Los Angeles-Long Beach-Anaheim, CA",http://www.livexlive.com,"LiveXLive Media, Inc., a digital media company, engages in the acquisition, distribution, and monetization of live music, Internet radio, and music-related streaming and video content. The company operates LiveXLive, a live music streaming platform; and Slacker Radio, a streaming music service, as well as produces original music-related content. It also produces, edits, curates, and streams live music events through broadband transmission over the Internet and satellite networks to its users; provides digital Internet radio and music services to users online and through original equipment manufacturers on a white label basis; and offers ancillary products and services, such as regulatory and post-implementation support services. In addition, the company offers an application that provides access to live events, audio streams, original episodic content, podcasts, video on demand, real-time livestreams, and social sharing of content. The company was formerly known as Loton, Corp. and changed its name to LiveXLive Media, Inc. in August 2017. LiveXLive Media, Inc. was founded in 2009 and is headquartered in West Hollywood, California.",FALSE,,"MidFirst Bank"
"Avalon Holdings Corporation",AWX,"NYSE MKT",0001061069,"Public Utilities","Environmental Services",5309339,,0000143774920009616,https://www.sec.gov/Archives/edgar/data/1061069/000143774920009616/0001437749-20-009616-index.htm,8-K,2020-05-06,2000000,,,521,Warren,Ohio,OH,44484,US,"Youngstown-Warren-Boardman, OH-PA",http://www.avalonholdings.com,"Avalon Holdings Corporation provides waste management services to industrial, commercial, municipal, and governmental customers in the United States. It operates through Waste Management Services, and Golf and Related Operations segments. The Waste Management Services segment offers hazardous and nonhazardous waste disposal brokerage and management services; and captive landfill management services, as well as engages in salt water injection well operations. This segment also provides turnkey services, including daily operations, facilities management, and management reporting; and sells construction mats. The Golf and Related Operations segment operates and manages three golf courses and related clubhouses, a hotel, and a travel agency. Its golf and country club facilities provide swimming pools, fitness centers, tennis courts, dining, and banquet and conference facilities, as well as spa services. The company also owns and operates hotel under the brand of The Grand Resort, which provides various facilities, such as swimming pool, fitness center, rooms, restaurants, bars, banquet, and conference facilities, as well as adjoining tennis center. The company was founded in 1998 and is headquartered in Warren, Ohio.",FALSE,,Unidentified
"Torotel, Inc.",TTLO,OTC,0000098752,Technology,"Electronic coils and transformers",13970097,,0000110465920049186,https://www.sec.gov/Archives/edgar/data/98752/000110465920049186/0001104659-20-049186-index.htm,8-K,2020-04-21,1984688,,,155,Olathe,Kansas,KS,66062,US,"Kansas City, MO-KS",http://www.torotelinc.com,"Torotel, Inc., through its subsidiary, Torotel Products, Inc., designs, manufactures, distributes, markets, and sells various precision magnetic components for use in military, commercial aerospace, and industrial electronic industries in the United States. The company's products include transformers, inductors, reactors, chokes, toroidal coils, high voltage transformers, dry-type transformers, and electro-mechanical assemblies. Its products are used to modify and control electrical voltages and currents in electronic devices. Torotel, Inc. sells its products to original equipment manufacturers, which use them in products, such as aircraft navigational equipment, digital control device, medical equipment, avionics equipment, down-hole drilling, conventional missile guidance system, and other defense and commercial aerospace applications. The company markets its products primarily through internal sales force and independent manufacturers' representatives. Torotel, Inc. was incorporated in 1956 and is based in Olathe, Kansas.",FALSE,,"Cornerstone Bank"
"Harrow Health, Inc.",HROW,NASDAQ,0001360214,"Health Care","Major Pharmaceuticals",176617334,,0000149315220007305,https://www.sec.gov/Archives/edgar/data/1360214/000149315220007305/0001493152-20-007305-index.htm,8-K,2020-04-29,1967100,,11770000,133,"San Diego",California,CA,92130,US,"San Diego-Carlsbad, CA",http://www.harrowinc.com,"Harrow Health, Inc., together with its subsidiaries, develops, produces, and sells medications for unmet needs primarily in the United States. The company primarily provides ophthalmology based formulations to physicians and patients; and sterile and non-sterile compounded medications. It also develops and commercializes therapeutics for treating ocular surface diseases; and non-intravenous sedation and anesthesia therapeutics for human medical procedures in hospital, outpatient, and in-office settings. Its products portfolio includes topical eye drop drug candidates, including SURF-100 and SURF-200; SURF-300, an oral capsule for treating patients suffering from ocular surface diseases, and DED signs and symptoms; Klarity drops to protect and rehabilitate the ocular surface pathology for patients with DED; MELT-100, a drug that is administered sublingually for conscious sedation during cataract surgery; MAY-66 that is used for the treatment of symptoms associated with Peyronie's disease; MAY-44, a non-estrogen topical analgesic gel; and other drug candidates for rare diseases. In addition, the company engages in the development of MAY-88, an oral anhydrous extend release suspension of pentosan polysulfate sodium for interstitial cystitis. The company was formerly known as Imprimis Pharmaceuticals, Inc. and changed its name to Harrow Health, Inc. in December 2018. Harrow Health, Inc. was founded in 1998 and is headquartered in San Diego, California.",FALSE,,"Renasant Bank"
"Crown Crafts, Inc.",CRWS,NASDAQ,0000025895,"Basic Industries",Textiles,71843465,,0000143774920008353,https://www.sec.gov/Archives/edgar/data/25895/000143774920008353/0001437749-20-008353-index.htm,8-K,2020-04-23,1963800,,20400000,163,Gonzales,Louisiana,LA,70737,US,"Baton Rouge, LA",http://www.crowncrafts.com,"Crown Crafts, Inc., through its subsidiaries, operates in the consumer products industry in the United States and internationally. It provides infant, toddler, and juvenile products, including infant and toddler beddings; blankets and swaddle blankets; nursery and toddler accessories; room dcors; reusable and disposable bibs; burp cloths; hooded bath towels and washcloths; reusable and disposable placemats, and floor mats; disposable toilet seat covers and changing mats; developmental toys; feeding and care goods; and other infant, toddler, and juvenile soft goods. The company sells its products primarily to mass merchants, mid-tier retailers, juvenile specialty stores, value channel stores, grocery and drug stores, restaurants, Internet accounts, and wholesale clubs through a network of sales force and independent commissioned sales representatives. Crown Crafts, Inc. was founded in 1957 and is headquartered in Gonzales, Louisiana.",FALSE,,"CIT Bank"
"Comstock Holding Companies, Inc.",CHCI,NASDAQ,0001299969,Finance,"Real Estate",25625747,,0000156459020025865,https://www.sec.gov/Archives/edgar/data/1299969/000156459020025865/0001564590-20-025865-index.htm,8-K,2020-05-15,1950000,,,106,Reston,Virginia,VA,20190,US,"Washington-Arlington-Alexandria, DC-VA-MD-WV",http://www.comstockcompanies.com,"Comstock Holding Companies, Inc. operates as a real estate development and services company primarily in the mid-Atlantic region, the United States. It operates through three segments: Homebuilding, Asset Management, and Real Estate Services. The company builds multi-family units, single-family homes, townhouses, mid-rise and high-rise condominiums, and mixed-use developments. It also provides real estate management services, including strategic planning, land development, entitlement, property management, sales and marketing, workout and turnaround strategies, financing, and general construction services; and development supply chain services, including capital markets, real estate brokerage, environmental consulting, and design services. In addition, the company engages in the commercial real estate investment and development, asset management, and real estate related services. The company was formerly known as Comstock Homebuilding Companies, Inc. and changed its name to Comstock Holding Companies, Inc. in June 2012. Comstock Holding Companies, Inc. was founded in 1985 and is headquartered in Reston, Virginia.",FALSE,,Unidentified
"Enservco Corporation",ENSV,"NYSE MKT",0000319458,Energy,"Oilfield Services/Equipment",12223693,,0000143774920007841,https://www.sec.gov/Archives/edgar/data/319458/000143774920007881/0001437749-20-007881-index.htm,8-K,2020-04-16,1939900,,12850000,186,Denver,Colorado,CO,80202,US,"Denver-Aurora-Lakewood, CO",http://www.enservco.com,"Enservco Corporation, through its subsidiaries, provides oil field services to the onshore oil and natural gas industry in the United States. The company operates through Production Services and Completion Services segments. It offers frac water heating, hot oiling, pressure testing, acidizing, water transfer, bacteria and scale treatment, freshwater and saltwater hauling, fluid disposal, frac tank rental, well site construction, and other general oil field services. The company owns and operates a fleet of approximately 390 specialized trucks, trailers, frac tanks, and other well-site related equipment. It operates in the Rocky Mountain region consisting of eastern Colorado and southern Wyoming, central Wyoming, northwestern New Mexico, and western North Dakota and eastern Montana; eastern United States region comprising the southern region of the Marcellus Shale formation and the Utica Shale formation in eastern Ohio; and the Central United States region, Texas panhandle, northwestern Oklahoma, and the Eagle Ford Shale in south Texas. The company was incorporated in 1980 and is headquartered in Denver, Colorado.",FALSE,,"East West Bank"
"Pharma-Bio Serv, Inc.",PBSV,OTC,0001304161,Healthcare,"Management consulting services",19551360,,0000165495420004655,https://www.sec.gov/Archives/edgar/data/1304161/000165495420004655/0001654954-20-004655-index.htm,8-K,2020-04-29,1931700,,4824000,185,Dorado,"Puerto Rico",PR,00646,US,"San Juan-Carolina-Caguas, PR",http://www.pharmabioserv.com,"Pharma-Bio Serv, Inc. operates as a compliance and technology transfer services consulting firm the United States, Europe, and Brazil markets. It provides compliance consulting services to the pharmaceutical, chemical, biotechnology, medical device, cosmetic, food industries, and allied products in Puerto Rico, the United States, Europe, and Brazil. The company's technical consulting services comprise regulatory compliance, validation, technology transfer, engineering, project management, and process support. Pharma-Bio Serv, Inc. was founded in 1993 and is headquartered in Dorado, Puerto Rico.",FALSE,,Unidentified
"Micropac Industries, Inc.",MPAD,OTC,0000065759,Technology,"Semiconductors and related devices",34807320,,0000101054920000066,https://www.sec.gov/Archives/edgar/data/65759/000101054920000066/0001010549-20-000066-index.htm,8-K,2020-04-23,1924400,,,132,Garland,Texas,TX,75040,US,"Dallas-Fort Worth-Arlington, TX",http://www.micropac.com,"Micropac Industries, Inc. designs, manufactures, and distributes various types of microelectronic circuits. The company's products and technologies include custom design hybrid microelectronic circuits; solid state relays and power controllers; custom optoelectronic assemblies and components; optocouplers; light-emitting diodes; hall-effect sensors; displays; power operational amplifiers; fiber optic components and assemblies; high temperature products; and radiation tolerant electronics. Its products are used as components and assemblies in a range of military, space, and industrial systems, including aircraft instrumentation and navigation systems, satellite systems, power supplies, electronic controls, computers, medical devices, and high-temperature products. The company markets its products through a direct technical sales staff, independent representatives, and independent stocking distributors in the United States and Western Europe, primarily to original equipment manufacturers and contractors. Micropac Industries, Inc. was founded in 1963 and is based in Garland, Texas.",FALSE,,"Frost Bank"
"The LGL Group, Inc.",LGL,"NYSE MKT",0000061004,"Capital Goods","Industrial Machinery/Components",51847360,,0000156459020017442,https://www.sec.gov/Archives/edgar/data/61004/000156459020017442/0001564590-20-017442-index.htm,8-K,2020-04-20,1907500,"Filed notice with SEC that the company will return $1,907,500 loan on 4/20/20.",7630000,183,Orlando,Florida,FL,32804,US,"Orlando-Kissimmee-Sanford, FL",http://www.lglgroup.com,"The LGL Group, Inc., together with its subsidiaries, engages in the design, manufacture, and marketing of frequency and spectrum control products in the United States and internationally. The company operates in two segments, Electronic Components and Electronic Instruments. The Electronic Components segment offers XTAL, clock oscillators, VCXO, TCXO OCXO, and DOCXO devices; and radio frequency, microwave and millimeter wave filters, diplexers, and solid-state power amplifiers. It also provides filter devices, which includes crystal, ceramic, LC, tubular, combline, cavity, interdigital, and metal insert waveguide, as well as digital, analog and mechanical tunable filters, switched filter arrays, and RF subsystems. This segment's products are used in infrastructure equipment for the telecommunications and network equipment industries; and electronic systems for applications in defense, aerospace, earth-orbiting satellites, down-hole drilling, medical devices, instrumentation, industrial devices, and global positioning systems. The Electronic Instruments segment designs and manufactures frequency and time reference standards, distribution amplifiers, redundancy auto switches, and NTP servers for timing and synchronization in various applications. Its products are used in computer networking, satellite earth stations, electric utilities, broadcasting, and telecommunication systems. The company was formerly known as Lynch Corporation and changed its name to The LGL Group, Inc. The LGL Group, Inc. was founded in 1917 and is based in Orlando, Florida.",TRUE,https://www.sec.gov/Archives/edgar/data/61004/000156459020025849/0001564590-20-025849-index.htm,"City National Bank"
"IZEA Worldwide, Inc.",IZEA,NASDAQ,0001495231,"Consumer Services",Advertising,88196485,,0000149523120000046,https://www.sec.gov/Archives/edgar/data/1495231/000149523120000046/0001495231-20-000046-index.htm,8-K,2020-04-24,1905100,,4990000,117,"Winter Park",Florida,FL,32789,US,"Orlando-Kissimmee-Sanford, FL",http://www.izea.com,"IZEA Worldwide, Inc. creates and operates online marketplaces that connect marketers and content creators. Its technology solutions enable the management of content workflow, creator search and targeting, bidding, analytics, and payment processing. The company engages creator for influencer marketing campaigns, or to create content for the marketers' use and distribution. It primarily sells influencer marketing and content campaigns through sales team and platforms. The company was formerly known as IZEA, Inc. and changed its name to IZEA Worldwide, Inc. in August 2018. IZEA Worldwide, Inc. was founded in 2006 and is headquartered in Winter Park, Florida.",FALSE,,"Western Alliance Bank"
"CUI Global, Inc.",CUI,NASDAQ,0001108967,Technology,"Electronic Components",23901532,,0000143774920009259,https://www.sec.gov/Archives/edgar/data/1108967/000143774920009259/0001437749-20-009259-index.htm,8-K,2020-05-04,1900000,,5300000,145,Tualatin,Oregon,OR,97062,US,"Portland-Vancouver-Hillsboro, OR-WA",http://www.cuiglobal.com,"CUI Global, Inc., through its subsidiaries, engages in the design, installation, and the commissioning of industrial gas sampling, measurement, and delivery systems in the United States and United Kingdom. It manufactures and delivers a range of technologies, including environmental monitoring, gas metering, process control, telemetry, gas sampling, and bio methane monitoring to the gas utilities, power generation, emissions, manufacturing, and automotive industries. CUI Global, Inc. was founded in 1998 and is based in Tualatin, Oregon.",FALSE,,"Bank of America"
"Legacy Education Alliance, Inc.",LEAI,OTC,0001561880,"Consumer Defensive","Services-Educational Services",2084625,,0000121390020010747,https://www.sec.gov/Archives/edgar/data/1561880/000121390020010747/0001213900-20-010747-index.htm,8-K,2020-05-01,1899832,,,120,"Cape Coral",Florida,FL,33904,US,"Cape Coral-Fort Myers, FL",http://www.legacyeducationalliance.com,"Legacy Education Alliance, Inc. provides educational training on the topics of personal finance, entrepreneurship, real estate, and financial markets investing strategies and techniques in North America, the United Kingdom, and internationally. The company offers its services under the Legacy Education and Homemade Investor by Tarek El Moussa brands. Legacy Education Alliance, Inc. provides its programs through various formats and channels, including free workshops, basic training classes, symposiums, forums, telephone mentoring, one-on-one mentoring, coaching, and e-learning. The company is based in Cape Coral, Florida.",FALSE,,"Pacific Premiere Bank"
"Tecogen Inc.",TGEN,NASDAQ,0001537435,"Capital Goods","Industrial Machinery/Components",20223142,,0000153743520000026,https://www.sec.gov/Archives/edgar/data/1537435/000153743520000026/0001537435-20-000026-index.htm,8-K,2020-04-17,1874200,,9330000,88,Waltham,Massachusetts,MA,02451,US,"Boston-Cambridge-Newton, MA-NH",http://www.tecogen.com,"Tecogen Inc. designs, manufactures, markets, and maintains industrial and commercial cogeneration systems that produce combinations of electricity, hot water, and air conditioning for residential, commercial, recreational, and industrial use in the United States and internationally. It operates in two segments, Products and Services, and Energy Production. The company offers InVerde e+, a cogeneration product that provides electricity and hot water; TECOGEN cogeneration systems for producing hot water; TECOCHILL air-conditioning and refrigeration chillers; and water heaters under the Ilios brand name, as well as emissions control technology under the Ultera brand name. It also provides long-term maintenance contracts, parts sales, and turnkey installation services through a network of 10 field service centers in California, the Midwest, the Northeast, and the Southeast. In addition, the company installs, owns, operates, and maintains distributed generation and other complementary systems. It serves hospitals and nursing homes, colleges and universities, health clubs and spas, hotels and motels, office and retail buildings, food and beverage processors, multi-unit residential buildings, laundries, ice rinks, swimming pools, factories, municipal buildings, military installations, and indoor growing facilities. The company was incorporated in 2000 and is headquartered in Waltham, Massachusetts.",FALSE,,"Webster Bank"
"JanOne Inc.",JAN,NASDAQ,0000862861,"Consumer Services","Home Furnishings",8948612,,0000156459020020860,https://www.sec.gov/Archives/edgar/data/862861/000156459020020860/0001564590-20-020860-index.htm,8-K,2020-05-04,1872218,,,199,"Las Vegas",Nevada,NV,89119,US,"Las Vegas-Henderson-Paradise, NV",http://www.janone.com,"JanOne Inc., together with its subsidiaries, engages in recycling, biotechnology, and technology business. It is involved in collecting, recycling, and installing appliances for utilities and other customers. The company also provides turnkey appliance recycling and replacement services for utilities and other sponsors of energy efficiency programs. It operates approximately 15 regional processing centers in the United States and Canada. In addition, the company designs and develops wireless transceiver modules with technology that provides location-based service from mobile Internet of Things network. Further, it focuses on developing non-opioid painkillers. The company was formerly known as Appliance Recycling Centers of America, Inc. and changed its name to JanOne Inc. in September 2019. JanOne Inc. was founded in 1976 and is headquartered in Las Vegas, Nevada.",FALSE,,"Texas Capital Bank"
"Wilhelmina International, Inc.",WHLM,NASDAQ,0001013706,"Consumer Services","Professional Services",23672209,,0000117184320002736,https://www.sec.gov/Archives/edgar/data/1013706/000117184320002736/0001171843-20-002736-index.htm,8-K,2020-04-21,1847700,,,114,Dallas,Texas,TX,75201,US,"Dallas-Fort Worth-Arlington, TX",http://www.wilhelmina.com,"Wilhelmina International, Inc. primarily engages in the fashion model management business. It specializes in the representation and management of models, entertainers, artists, athletes, and other talent to various clients, including retailers, designers, advertising agencies, print and electronic media and catalog companies. The company offers fashion modeling talent and social media influencer services to clients, such as advertising agencies, branded consumer goods companies, fashion designers, Internet sites, retailers, department stores, product catalogs, and magazine publications; and represents artists in the hair, makeup, photography, and stylist arenas to various companies in the media, advertising, retail, pharmaceutical, and music industries. It is also involved in the licensing of the Wilhelmina name to third-parties, such as fashion model agencies; television syndication royalties and production series contracts; and celebrity management activities. The company has operations in Los Angeles, Miami, Chicago, and London, as well as a network of licensees in various local markets in the United States and internationally. Wilhelmina International, Inc. was founded in 1967 and is headquartered in Dallas, Texas.",FALSE,,"Zions Bancorporation"
"Xcel Brands, Inc.",XELB,NASDAQ,0001083220,Miscellaneous,"Multi-Sector Companies",23269558,,0000155837020004360,https://www.sec.gov/Archives/edgar/data/1083220/000155837020004360/0001558370-20-004360-index.htm,8-K,2020-04-27,1805856,,8200000,78,"New York","New York",NY,10018,US,"New York-Newark-Jersey City, NY-NJ-PA",http://www.xcelbrands.com,"Xcel Brands, Inc., together with its subsidiaries, operates as a media and consumer products company in the United States. The company designs, produces, licenses, markets, and sells branded apparel, footwear, accessories, jewelry, home goods, and other consumer products; and acquires consumer lifestyle brands, including the Isaac Mizrahi, the Judith Ripka, the H Halston, the Halston Heritage, and the C Wonder brands. It licenses its brands to third parties; and provides design, production, and marketing services for promotion and distribution through a ubiquitous-channel retail sales strategy, including distribution through interactive television, the Internet, and traditional brick-and-mortar retail channels. The company also offers social media marketing and other marketing, and public relations support for its brands. In addition, it markets the Mizrahi brands through isaacmizrahi.com; the Halston Brand through halston.com; the Judith Ripka Fine Jewelry brand through judithripka.com; and the C Wonder brands through cwonder.com. Xcel Brands, Inc. is headquartered in New York, New York.",FALSE,,"Bank of America"
"RiceBran Technologies",RIBT,NASDAQ,0001063537,"Consumer Non-Durables","Packaged Foods",25603282,,0000114036120009038,https://www.sec.gov/Archives/edgar/data/1063537/000114036120009038/0001140361-20-009038-index.htm,8-K,2020-04-16,1800000,,8520000,121,"The Woodlands",Texas,TX,77380,US,"Houston-The Woodlands-Sugar Land, TX",http://www.ricebrantech.com,"RiceBran Technologies operates as a specialty ingredient company. It focuses on producing value-added processing and marketing of healthy, natural, and nutrient dense products derived from rice and other small grains, and by-products created in the milling of these grains. The company converts raw rice bran into stabilized rice bran (SRB) and high value derivative products, including RiBalance, a complete rice bran nutritional package derived from further processing of SRB; RiSolubles, a nutritious carbohydrate and lipid rich fraction of RiBalance; RiFiber, a protein and fiber rich insoluble derivative of RiBalance; and ProRyza products, which includes derivatives composed of protein and protein/fiber blends. Its SRB and derivative products are nutritional and beneficial food products that contain a combination of oil, protein, carbohydrates, vitamins, minerals, fibers, and antioxidants that enhance the nutritional value of consumer products. The company's SRB products are also marketed as feed ingredients in the animal nutrition markets. It serves food and animal nutrition manufacturers, wholesalers, and retailers in the United States and internationally. The company was formerly known as NutraCea and changed its name to RiceBran Technologies in October 2012. RiceBran Technologies was founded in 2000 and is headquartered in The Woodlands, Texas.",FALSE,,"Spirit of Texas Bank"
