source:,https://www.sec.gov/cgi-bin/browse-edgar?action=getcurrent,,forms_checked:,53161
number_loans:,1,,total_loan_amount:,1390298467
last_updated:,"2021-01-07 00:07:57"
name,ticker,exchange,cik,sector,industry,market_cap,market_cap_date,accession_number,sec_url,form,sec_filing_date,loan_amount_usd,note,revenue_consensus,full_time_employees,city,state,state_code,zipcode,country_code,metro_area_cbsa,website,summary,returned_loan,return_filing,bank
"Ashford Hospitality Trust, Inc.",AHT,NYSE,0001232582,"Consumer Services","Real Estate Investment Trusts",137808326,,0000123258220000021,https://www.sec.gov/Archives/edgar/data/1232582/000123258220000021/0001232582-20-000021-index.htm,8-K,2020-04-24,45900000,"Filed notice with SEC that the company will return $45,900,000 loan on 4/24/20.",327380000,,Dallas,Texas,TX,75254,US,"Dallas-Fort Worth-Arlington, TX",http://www.ahtreit.com,"Ashford Hospitality Trust is a real estate investment trust (REIT) focused on investing predominantly in upper upscale, full-service hotels.",TRUE,https://www.sec.gov/Archives/edgar/data/1232582/000110465920055829/0001104659-20-055829-index.htm,KeyBank
"Ashford Hospitality Trust, Inc.",AHT,NYSE,0001232582,"Consumer Services","Real Estate Investment Trusts",137808326,,0000123258220000017,https://www.sec.gov/Archives/edgar/data/1232582/000123258220000017/0001232582-20-000017-index.htm,8-K,2020-04-21,30100000,"Filed notice with SEC that the company will return $30,100,000 loan on 4/21/20.",327380000,,Dallas,Texas,TX,75254,US,"Dallas-Fort Worth-Arlington, TX",http://www.ahtreit.com,"Ashford Hospitality Trust is a real estate investment trust (REIT) focused on investing predominantly in upper upscale, full-service hotels.",TRUE,https://www.sec.gov/Archives/edgar/data/1232582/000110465920055829/0001104659-20-055829-index.htm,KeyBank
"Ruth's Hospitality Group, Inc.",RUTH,NASDAQ,0001324272,"Consumer Services",Restaurants,618772514,,0000156459020016452,https://www.sec.gov/Archives/edgar/data/1324272/000156459020016452/0001564590-20-016452-index.htm,8-K,2020-04-13,20000000,"Filed notice with SEC that the company will return $20,000,000 loan on 4/13/20.",126790000,5740,"Winter Park",Florida,FL,32789,US,"Orlando-Kissimmee-Sanford, FL",http://www.rhgi.com,"Ruth's Hospitality Group, Inc., together with its subsidiaries, develops, operates, and franchises fine dining restaurants under the Ruth's Chris Steak House name. The company's restaurants offer food and beverage products to special occasion diners and frequent customers, as well as business clientele. As of February 28, 2020, it had approximately 150 company-owned and franchisee-owned restaurants worldwide. The company was formerly known as Ruth's Chris Steak House, Inc. and changed its name to Ruth's Hospitality Group, Inc. in May 2008. Ruth's Hospitality Group, Inc. was founded in 1965 and is headquartered in Winter Park, Florida.",TRUE,https://www.sec.gov/Archives/edgar/data/1324272/000156459020018289/0001564590-20-018289-index.htm,"JPMorgan Chase Bank"
"Braemar Hotels & Resorts, Inc.",BHR,NYSE,0001574085,"Consumer Services","Real Estate Investment Trusts",169125821,,0000157408520000016,https://www.sec.gov/Archives/edgar/data/1574085/000157408520000016/0001574085-20-000016-index.htm,8-K,2020-04-24,18500000,"Filed notice with SEC that the company will return $18,500,000 loan on 4/24/20.",126160000,,Dallas,Texas,TX,75254,US,"Dallas-Fort Worth-Arlington, TX",http://www.bhrreit.com,"Braemar Hotels & Resorts is a conservatively capitalized REIT that invests primarily in high RevPAR, full-service luxury hotels and resorts. We are listed on the New York Stock Exchange under the symbol BHR and are externally-advised by Ashford (NYSE American: AINC).",TRUE,https://www.sec.gov/Archives/edgar/data/1574085/000110465920055826/0001104659-20-055826-index.htm,KeyBank
"The ONE Group Hospitality, Inc.",STKS,NASDAQ,0001399520,"Consumer Services",Restaurants,107551626,,0000155837020006051,https://www.sec.gov/Archives/edgar/data/1399520/000155837020006051/0001558370-20-006051-index.htm,8-K,2020-05-08,18300000,,30760000,3400,Denver,Colorado,CO,80202,US,"Denver-Aurora-Lakewood, CO",http://www.togrp.com,"The ONE Group Hospitality, Inc., a hospitality company, develops, owns, and operates restaurants and lounges worldwide. It operates through STK, Kona Grill, and ONE Hospitality segments. The company also provides turn-key food and beverage services for hospitality venues, including hotels, casinos, and other locations. Its hospitality food and beverage solutions include developing, managing, and operating restaurants, bars, rooftops, pools, banqueting, catering, private dining rooms, room service, and mini bars. The company operates restaurants primarily under the STK and Kona Grill brands. As of December 31, 2019, the Company owned, operated, managed, or licensed 55 venues, including 20 STKs and 24 Kona Grills in North America, Europe, and the Middle East. The company was founded in 2004 and is headquartered in Denver, Colorado.",FALSE,,BBVA
"Braemar Hotels & Resorts, Inc.",BHR,NYSE,0001574085,"Consumer Services","Real Estate Investment Trusts",169125821,,0000157408520000013,https://www.sec.gov/Archives/edgar/data/1574085/000157408520000013/0001574085-20-000013-index.htm,8-K,2020-04-21,15800000,"Filed notice with SEC that the company will return $15,800,000 loan on 4/21/20.",126160000,,Dallas,Texas,TX,75254,US,"Dallas-Fort Worth-Arlington, TX",http://www.bhrreit.com,"Braemar Hotels & Resorts is a conservatively capitalized REIT that invests primarily in high RevPAR, full-service luxury hotels and resorts. We are listed on the New York Stock Exchange under the symbol BHR and are externally-advised by Ashford (NYSE American: AINC).",TRUE,https://www.sec.gov/Archives/edgar/data/1574085/000110465920055826/0001104659-20-055826-index.htm,KeyBank
"J. Alexander's Holdings, Inc.",JAX,NYSE,0001617227,"Consumer Services",Restaurants,109860861,,0000119312520109428,https://www.sec.gov/Archives/edgar/data/1617227/000119312520109428/0001193125-20-109428-index.htm,8-K,2020-04-16,15100000,"Filed notice with SEC that the company will return $15,100,000 loan on 4/16/20.",63439000,4200,Nashville,Tennessee,TN,37202,US,"Nashville-Davidson-Murfreesboro-Franklin, TN",http://www.jalexandersholdings.com,"J. Alexander's Holdings, Inc., through its subsidiaries, owns and operates complementary upscale dining restaurants in the United States. It operates restaurants under various concepts, including J. Alexander's, Redlands Grill, Lyndhurst Grill, Overland Park Grill, Merus Grill, and Stoney River Steakhouse and Grill. The company's restaurants offer American menu. As of April 20, 2020, it operated 47 restaurants in 16 states. J. Alexander's Holdings, Inc. was founded in 1970 and is headquartered in Nashville, Tennessee.",TRUE,https://www.sec.gov/Archives/edgar/data/1617227/000119312520118678/0001193125-20-118678-index.htm,"Pinnacle Bank"
"OneWater Marine Inc.",ONEW,NASDAQ,0001772921,"Consumer Services","Other Specialty Stores",435631419,,0000114036120010062,https://www.sec.gov/Archives/edgar/data/1772921/000114036120010062/0001140361-20-010062-index.htm,8-K,2020-04-29,14100000,"Filed notice with SEC that the company will return $14,100,000 loan on 4/29/20.",191470000,1102,Buford,Georgia,GA,30518,US,"Atlanta-Sandy Springs-Roswell, GA",http://www.onewatermarine.com,"OneWater Marine Inc. operates as a recreational boat retailer in the United States. It offers new and pre-owned recreational boats and yachts, as well as related marine products, such as parts and accessories. The company also provides boat repair and maintenance services; arranges boat financing and insurance; and other ancillary services, including indoor and outdoor storage, and marina, as well as rental of boats and personal watercraft. As of October 21, 2019, it operated 63 stores comprising 21 dealer groups in 11 states. The company was founded in 2014 and is headquartered in Buford, Georgia.",TRUE,https://www.sec.gov/Archives/edgar/data/1772921/000114036120010909/0001140361-20-010909-index.htm,"Hancock Whitney Bank"
"Ashford Inc.",AINC,"NYSE MKT",0001604738,"Consumer Services","Professional Services",23017364,,0000160473820000016,https://www.sec.gov/Archives/edgar/data/1604738/000160473820000016/0001604738-20-000016-index.htm,8-K,2020-04-22,12800000,"Filed notice with SEC that the company will return $12,800,000 loan on 4/22/20.",90650000,123,Dallas,Texas,TX,75254,US,"Dallas-Fort Worth-Arlington, TX",http://www.ashfordinc.com,"Ashford, Inc is an asset management firm. The firm provides investment management and related services to the real estate and hospitality sectors. Ashford, Inc was formed on April 2, 2014 and is based in Dallas, Texas. Ashford Inc.(AMEX:AINC) operates independently of Ashford Hospitality Trust, Inc. as of November 5, 2019.",TRUE,https://www.sec.gov/Archives/edgar/data/1604738/000110465920055828/0001104659-20-055828-index.htm,KeyBank
"Good Times Restaurants Inc.",GTIM,NASDAQ,0000825324,"Consumer Services",Restaurants,35993790,,0000121465920004365,https://www.sec.gov/Archives/edgar/data/825324/000121465920004365/0001214659-20-004365-index.htm,8-K,2020-05-12,11645000,,30300000,2535,Lakewood,Colorado,CO,80228,US,"Denver-Aurora-Lakewood, CO",http://www.goodtimesburgers.com,"Good Times Restaurants Inc., through its subsidiaries, engages in the restaurant business in the United States. The company operates and franchises Good Times Burgers & Frozen Custard, an upscale quick-service drive-through dining restaurant; and owns, operates, franchises, and licenses Bad Daddy's Burger Bar, a full-service upscale casual dining restaurant. As of December 16, 2019, it operated, franchised or licensed 39 Bad Daddy's Burger Bar restaurants; and 34 Good Times Burgers & Frozen Custard restaurants. The company was founded in 1987 and is based in Lakewood, Colorado.",FALSE,,"Cadence Bank"
"FreightCar America, Inc.",RAIL,NASDAQ,0001320854,"Capital Goods",Railroads,37438938,,0000117184320002866,https://www.sec.gov/Archives/edgar/data/1320854/000117184320002866/0001171843-20-002866-index.htm,8-K,2020-04-24,10000000,,28500000,496,Chicago,Illinois,IL,60606,US,"Chicago-Naperville-Elgin, IL-IN-WI",http://www.freightcaramerica.com,"FreightCar America, Inc., through its subsidiaries, designs, manufactures, and sells railcars and railcar components for the transportation of bulk commodities and containerized freight products primarily in North America. It operates through two segments, Manufacturing and Parts. The company offers a range of freight cars, including covered hopper cars; open top hoppers; coil gondolas; triple hoppers and hybrid aluminum/stainless steel railcars; ore hopper and gondola railcars; ballast hopper cars; aggregate hopper cars; intermodal flat cars; and non-intermodal flat cars. It also provides coal cars, bulk commodity cars, coil steel cars, and boxcars; and woodchip hoppers, aluminum vehicle carriers, intermodal doublestack railcars, and articulated bulk container railcars. In addition, the company sells used railcars; leases and rebuilds railcars; and sells forged, cast, and fabricated parts for various railcars. It also exports its manufactured railcars to Latin America and the Middle East. The company's customers primarily include railroads, shippers, and financial institutions. FreightCar America, Inc. was founded in 1901 and is headquartered in Chicago, Illinois.",FALSE,,"JPMorgan Chase Bank"
"Harte Hanks, Inc.",HHS,NYSE,0000045919,Technology,Advertising,17328313,,0000143774920008460,https://www.sec.gov/Archives/edgar/data/45919/000143774920008460/0001437749-20-008460-index.htm,8-K,2020-04-24,10000000,,39500000,1943,"San Antonio",Texas,TX,78216,US,"San Antonio-New Braunfels, TX",http://www.hartehanks.com,"Harte Hanks, Inc. provides various multi-channel marketing services in the United States and internationally. The company provides agency services, such as customer engagement solutions in direct and digital communications for consumer and business-to-business markets; digital services, including search engine management, display, digital analytics, Website development and design, digital strategy, social media, email, e-commerce, and interactive relationship management services; and database marketing and business-to-business lead generation solutions that offer insight and analytics, customer data integration, and marketing communications tools. It also provides direct marketing services, including digital printing, print on demand, advanced mail optimization, logistics and transportation optimization, tracking, commingling, shrink wrapping, and specialized mailing services, as well as custom kitting, print on demand, product recalls, and freight optimization services through its fulfillment centers; and operates teleservice workstations, which offer contact center solutions comprising speech, voice and video chat, integrated voice response, analytics, social cloud monitoring, and Web self-services. The company provides its services primarily to the retail, B2B, financial services, consumer, and healthcare vertical markets. Harte Hanks, Inc. was founded in 1923 and is headquartered in San Antonio, Texas.",FALSE,,"Texas Capital Bank"
"Quantum Corporation",QMCO,NASDAQ,0000709283,Technology,"Electronic Components",249330097,,0000162828020005063,https://www.sec.gov/Archives/edgar/data/709283/000162828020005063/0001628280-20-005063-index.htm,8-K,2020-04-16,10000000,,87020000,800,"San Jose",California,CA,95110,US,"San Jose-Sunnyvale-Santa Clara, CA",http://www.quantum.com,"Quantum Corporation provides products for storing and managing video and video-like data in the Americas, Europe, and the Asia Pacific. The company offers StorNext software systems for video editing, and management of large video and image datasets; and Scalar tape systems that provide long-term data storage facility to archive and preserve digital content for decades. It also provides DXi backup systems for backup storage and multi-site disaster recovery; and surveillance and industrial Internet of Things storage systems, such as Cloud Storage Platform Software that offer block storage to record and store video. In addition, the company offers Ruggedized Storage Systems, which are removable storage systems for in-vehicle data capture, mobile surveillance, and military applications; and related maintenance, implementation, and training services. Further, it sells linear tape-open (LTO) tape cartridges, as well as standalone LTO tape drives for small business and desktop applications. The company sells its products through a network of distributors, value-added resellers, direct marketing resellers, original equipment manufacturers, and other suppliers, as well as directly to corporate entities and government agencies. Quantum Corporation was founded in 1980 and is headquartered in San Jose, California.",FALSE,,"PNC Bank"
"GSE Systems, Inc.",GVP,NASDAQ,0000944480,Technology,"Computer Software: Prepackaged Software",27220265,,0000094448020000027,https://www.sec.gov/Archives/edgar/data/944480/000094448020000027/0000944480-20-000027-index.htm,8-K,2020-04-30,10000000,,18400000,,Sykesville,Maryland,MD,21784,US,"Baltimore-Columbia-Towson, MD",http://www.gses.com,"GSE Systems, Inc. provides simulation, training, and engineering solutions to the power and process industries in the United States, Asia, Europe, and internationally. It operates through two segments, Performance Improvement Solutions and Nuclear Industry Training and Consulting. The Performance Improvement Solutions segment provides various simulation products, engineering services, and operation training systems for the nuclear, fossil fuel power generation, and process industries. The Nuclear Industry Training and Consulting segment offers instructors, procedure writers, project managers, work management specialists, and planners and training material developers for the nuclear power industry. The company markets its products and services through a network of direct sales staff, agents and representatives, and strategic alliance partners. GSE Systems, Inc. was founded in 1994 and is headquartered in Sykesville, Maryland.",FALSE,,"Citizen's Bank"
"MiMedx Group, Inc.",MDXG,OTC,0001376339,"Health Care","Medical/Dental Instruments",1008292395,,0000137633920000019,https://www.sec.gov/Archives/edgar/data/1376339/000137633920000019/0001376339-20-000019-index.htm,8-K,2020-04-21,10000000,"Filed notice with SEC that the company will return $10,000,000 loan on 4/21/20.",84500000,753,Marietta,Georgia,GA,30062,US,"Atlanta-Sandy Springs-Roswell, GA",http://www.mimedx.com,"MiMedx Group, Inc., a biopharmaceutical company, develops and markets regenerative biologics utilizing human placental tissue allografts with patent-protected processes for various sectors of healthcare. It processes the human placental tissue utilizing its proprietary PURION Process to produce allografts. The company's proprietary processing methodology employs aseptic processing techniques in addition to terminal sterilization. Its biomaterial platform technologies include AmnioFix and EpiFix that are tissue technologies processed from human amniotic membrane derived from donated placental tissue for homologous applications; OrthoFlo, an amniotic fluid-derived allograft for homologous applications; Physio, a bone grafting material comprising 100% bone tissue with no added carrier; and CollaFix, a technology platform derived from collagen fiber technology designed to mimic the natural composition, structure, and mechanical properties of musculoskeletal tissues to augment their repair. The company also offers EpiCord, an umbilical cord allograft that provides a connective tissue matrix to replace or supplement damaged or inadequate integumental tissue; AmnioCord, an umbilical cord allograft that offers a protective environment for the healing process; and AmnioFill, a cellular tissue matrix allograft that enhances healing. Its products have applications in the areas of wound care, burns, surgery, orthopedics, spine, sports medicine, ophthalmology, and dentistry. The company sells its products through direct sales force, and independent stocking distributors, and third party representatives in the United States, as well as independent distributors internationally. MiMedx Group, Inc. is headquartered in Marietta, Georgia.",TRUE,https://www.sec.gov/Archives/edgar/data/1376339/000137633920000031/0001376339-20-000031-index.htm,"Bank of America"
"CalAmp Corp.",CAMP,NASDAQ,0000730255,Technology,"Radio And Television Broadcasting And Communications Equipment",347544442,,0000156459020017709,https://www.sec.gov/Archives/edgar/data/730255/000156459020017709/0001564590-20-017709-index.htm,8-K,2020-04-21,10000000,"Filed notice with SEC that the company will return $10,000,000 loan on 4/21/20.",85950000,882,Irvine,California,CA,92618,US,"Los Angeles-Long Beach-Anaheim, CA",http://www.calamp.com,"CalAmp Corp. provides in telematics systems, and software and subscription services in the United States, Latin America, Western Europe, Asia Pacific, the Middle East, Africa, and internationally. The company offers mobile resource management telematics devices for the Internet of Things market, which enable customers to optimize their operations by collecting, monitoring, and reporting business-critical information and desired intelligence from remote and mobile assets. It also provides telematics products, including asset tracking units, mobile telematics devices, fixed and mobile wireless gateways, and routers. In addition, the company offers CalAmp Telematics Cloud platform, such as cloud-based application enablement and telematics service platforms that facilitate integration of its own applications, as well as those of third parties, through open application programming interfaces; and software as a service applications. It sells its products and services to customers in the automotive, insurance, transportation and logistics, government, construction, and utilities markets through direct sales organization, a channel partner program and an international network of licensees, and sales representatives, as well as its Websites and digital presence. CalAmp Corp. has a strategic relationship with Sprint to deliver intelligent telematics devices and software applications. The company was founded in 1981 and is headquartered in Irvine, California.",TRUE,https://www.sec.gov/Archives/edgar/data/730255/000156459020018849/0001564590-20-018849-index.htm,"JPMorgan Chase Bank"
"IDT Corporation",IDT,NYSE,0001005731,"Public Utilities","Telecommunications Equipment",315385510,,0000121390020010054,https://www.sec.gov/Archives/edgar/data/1005731/000121390020010054/0001213900-20-010054-index.htm,8-K,2020-04-24,10000000,"Filed notice with SEC that the company will return $10,000,000 loan on 4/24/20.",,1270,Newark,"New Jersey",NJ,07102,US,"New York-Newark-Jersey City, NY-NJ-PA",http://www.idt.net,"IDT Corporation operates primarily in the telecommunications and payment industries in the United States and internationally. The company operates in two segments, Telecom & Payment Services, and net2phone-Unified Communications as a Service. The Telecom & Payment Services Services segment offers retail telecommunication products, including international long-distance calling products primarily to foreign-born communities; wholesale international long distance traffic termination services for tier 1 fixed line and mobile network operators, as well as for other service providers; and payment offerings, such as international and domestic airtime top-up, domestic bill payment, and international money transfer services. The net2phone-Unified Communications as a Service segment provides voice over Internet protocol products and services under the net2phone brand name, including cloud-based private branch exchange (PBX) services to enterprise customers primarily through value-added resellers, service providers, telecom agents, and managed service providers; session initiation protocol trunking services, which support inbound and outbound domestic and international calling from an IP PBX; and cable telephony services. IDT Corporation was founded in 1990 and is headquartered in Newark, New Jersey.",TRUE,https://www.sec.gov/Archives/edgar/data/1005731/000121390020010106/0001213900-20-010106-index.htm,"TD Bank"
"Hallador Energy Company",HNRG,NASDAQ,0000788965,Energy,"Coal Mining",44784528,,0000078896520000009,https://www.sec.gov/Archives/edgar/data/788965/000078896520000009/0000788965-20-000009-index.htm,8-K,2020-04-16,10000000,,67900000,915,"Terre Haute",Indiana,IN,47802,US,"Terre Haute, IN",http://www.halladorenergy.com,"Hallador Energy Company, through its subsidiaries, engages in the mining, production, and sale of steam coal for the electric power generation industry in the United States. The company holds interests in the Oaktown 1 mine underground mine located in Knox County, Indiana; the Oaktown 2 mine located in Knox County, Indiana and Lawrence County, Illinois; Carlisle underground coal mine located near the town of Carlisle, Indiana; and Ace in the Hole mine located near Clay City, Indiana. It is also involved in gas exploration activities in Indiana. The company was founded in 1949 and is headquartered in Terre Haute, Indiana.",FALSE,,"First Financial Bank"
"Independence Contract Drilling, Inc.",ICD,NYSE,0001537028,Energy,"Oil & Gas Production",18156905,,0000153702820000074,https://www.sec.gov/Archives/edgar/data/1537028/000153702820000074/0001537028-20-000074-index.htm,8-K,2020-05-01,10000000,,37100000,650,Houston,Texas,TX,77070,US,"Houston-The Woodlands-Sugar Land, TX",http://www.icdrilling.com,"Independence Contract Drilling, Inc. provides land-based contract drilling services for oil and natural gas producers in the United States. The company constructs, owns, and operates a fleet of pad-optimal ShaleDriller rigs that are engineered and designed to accelerate its clients' production profiles and cash flows from their technically demanding and economically impactful oil and gas properties in the Permian Basin, the Haynesville Shale, and the Eagle Ford Shale. Its fleet consists of 29 rigs. The company was founded in 2011 and is headquartered in Houston, Texas.",FALSE,,"City Bank"
"Luby's, Inc.",LUB,NYSE,0000016099,"Consumer Services",Restaurants,87127704,,0000001609920000063,https://www.sec.gov/Archives/edgar/data/16099/000001609920000063/0000016099-20-000063-index.htm,8-K,2020-04-23,10000000,,,6133,Houston,Texas,TX,77040,US,"Houston-The Woodlands-Sugar Land, TX",http://www.lubysinc.com,"Luby's, Inc. provides restaurant services in the United States. It operates through five segments: Luby's restaurants, Fuddruckers restaurants, Cheeseburger in Paradise restaurants, Fuddruckers franchise operations, and Culinary Contract Services. The company operates casual dining restaurants; and offers culinary contract services, including contract arrangements to manage food services for healthcare clients, corporate dining clients, government buildings, and sports stadiums, as well as through retail grocery stores. Its primary brands include Luby's Cafeteria, Fuddruckers - World's Greatest Hamburgers, and Cheeseburger in Paradise, as well as Luby's Culinary Contract Services. As of August 29, 2019, the company operated 124 restaurants; and franchised 102 Fuddruckers restaurants. As of November 15, 2019, it operated 32 locations through Culinary Contract Services. The company was formerly known as Luby's Cafeterias, Inc. Luby's, Inc. was founded in 1947 and is headquartered in Houston, Texas.",FALSE,,"Texas Capital Bank"
